{
  "skill": "sayelf-nature-encounter",
  "version": "0.1.1",
  "nature_event": {
    "event_id": "NE-002",
    "title": "雨后兰花与夜蛾",
    "subject": "一只褐色夜蛾",
    "plant": "一朵低垂的白色兰花",
    "habitat": "雨后林缘的暗绿色叶层与一小片湿润苔藓之间",
    "relationship": "夜蛾在花前悬停，口器触到花心寻找落点",
    "decisive_moment": "口器刚触到花心，翅膀仍保持悬停的细微振动",
    "moment_phase": "during_touch",
    "physical_trace": "花粉落在口器附近，兰花唇瓣轻轻回弹",
    "camera": {
      "position": "与花心齐平的侧面微距机位，藏在一片前景叶片后",
      "lens_feel": "短距离微距，主体清晰而背景快速自然失焦",
      "composition": "夜蛾位于偏左，白色花心位于关系发生点，湿叶形成不完整的前景边缘"
    },
    "light": "雨后云层变薄时的冷柔自然光，花瓣反射微亮，叶面保留湿润暗部",
    "silence_layer": "远处低信息密度的暗绿色叶层与湿苔藓，只保留几处雨后水光和缓慢叶影，不制造第二个焦点",
    "grammar": ["DWELL", "MEET", "TOUCH", "BREATHE", "TRACE"],
    "locks": {
      "reality_lock": [
        "夜蛾、口器、翅膀与兰花花心保持可解释的相对尺度",
        "雨滴、花粉和湿叶只出现在可接触的表面，光线服从雨后自然光",
        "微距景深逐层衰减，不把所有叶片和翅脉同时处理成锐利图形"
      ],
      "continuity_lock": [
        "NE-002 始终是同一只褐色夜蛾、同一朵白色兰花和同一处雨后林缘",
        "夜蛾从画面右侧进入并向左侧花心靠近，花朵位置与冷柔光方向不改变",
        "事件只从悬停推进到触花、花瓣回弹和花粉留下，不跳到白天或另一种植物"
      ],
      "negative_lock": [
        "不要第二只昆虫、人物、花束或彩色背景抢走关系焦点",
        "不要梦幻光晕、发光花粉、CGI、塑料叶片、假散景或过度 HDR",
        "不要人工布景、棚拍光、对称花艺构图或所有景物同时清晰",
        "不要改变夜蛾颜色、兰花形状、雨后时段、镜头侧别或空间方向",
        "不要文字、字幕、标题、标志、水印、边框或戏剧化的捕食叙事"
      ]
    }
  },
  "outputs": {
    "image": {
      "id": "01 IMAGE",
      "kind": "IMAGE",
      "event_id": "NE-002",
      "grammar": ["DWELL", "MEET", "TOUCH", "BREATHE", "TRACE"],
      "prompt": "雨后林缘的暗绿色叶层与一小片湿润苔藓之间，一只褐色夜蛾在一朵低垂白色兰花前悬停，口器刚触到花心；真实微距自然摄影。DWELL、MEET、TOUCH、BREATHE、TRACE；SILENCE LAYER 保持低信息密度。Reality Lock、Continuity Lock、Negative Lock 全部生效。",
      "silence_layer": "远处低信息密度的暗绿色叶层与湿苔藓，只保留几处雨后水光和缓慢叶影，不制造第二个焦点",
      "reality_lock": [
        "夜蛾、口器、翅膀与兰花花心保持可解释的相对尺度",
        "雨滴、花粉和湿叶只出现在可接触的表面，光线服从雨后自然光",
        "微距景深逐层衰减，不把所有叶片和翅脉同时处理成锐利图形"
      ],
      "continuity_lock": [
        "NE-002 始终是同一只褐色夜蛾、同一朵白色兰花和同一处雨后林缘",
        "夜蛾从画面右侧进入并向左侧花心靠近，花朵位置与冷柔光方向不改变",
        "事件只从悬停推进到触花、花瓣回弹和花粉留下，不跳到白天或另一种植物"
      ],
      "negative_lock": [
        "不要第二只昆虫、人物、花束或彩色背景抢走关系焦点",
        "不要梦幻光晕、发光花粉、CGI、塑料叶片、假散景或过度 HDR",
        "不要人工布景、棚拍光、对称花艺构图或所有景物同时清晰",
        "不要改变夜蛾颜色、兰花形状、雨后时段、镜头侧别或空间方向",
        "不要文字、字幕、标题、标志、水印、边框或戏剧化的捕食叙事"
      ]
    },
    "video": {
      "id": "02 VIDEO",
      "kind": "VIDEO",
      "event_id": "NE-002",
      "grammar": ["DWELL", "MEET", "TOUCH", "BREATHE", "TRACE"],
      "prompt": "从 01 IMAGE 的同一关键帧开始展开 NE-002。DWELL → MEET → TOUCH → BREATHE → TRACE；SILENCE LAYER 保持低信息密度；Reality Lock、Continuity Lock、Negative Lock 全部生效。",
      "silence_layer": "远处低信息密度的暗绿色叶层与湿苔藓，只保留几处雨后水光和缓慢叶影，不制造第二个焦点",
      "reality_lock": [
        "夜蛾、口器、翅膀与兰花花心保持可解释的相对尺度",
        "雨滴、花粉和湿叶只出现在可接触的表面，光线服从雨后自然光",
        "微距景深逐层衰减，不把所有叶片和翅脉同时处理成锐利图形"
      ],
      "continuity_lock": [
        "NE-002 始终是同一只褐色夜蛾、同一朵白色兰花和同一处雨后林缘",
        "夜蛾从画面右侧进入并向左侧花心靠近，花朵位置与冷柔光方向不改变",
        "事件只从悬停推进到触花、花瓣回弹和花粉留下，不跳到白天或另一种植物"
      ],
      "negative_lock": [
        "不要第二只昆虫、人物、花束或彩色背景抢走关系焦点",
        "不要梦幻光晕、发光花粉、CGI、塑料叶片、假散景或过度 HDR",
        "不要人工布景、棚拍光、对称花艺构图或所有景物同时清晰",
        "不要改变夜蛾颜色、兰花形状、雨后时段、镜头侧别或空间方向",
        "不要文字、字幕、标题、标志、水印、边框或戏剧化的捕食叙事"
      ],
      "storyboard": [
        { "shot_id": "S01", "stage": "DWELL", "duration_s": 2, "frame": "雨后叶层和湿苔藓的低机位环境", "camera": "缓慢横移", "action": "叶影和水光轻微移动", "transition_in": "承接静止关键帧", "transition_out": "右侧留出入口", "prompt": "S01 DWELL：只展示雨后林缘的低信息密度环境，保持自然光和微距景深。" },
        { "shot_id": "S02", "stage": "MEET", "duration_s": 2, "frame": "夜蛾从右侧进入白色兰花前", "camera": "沿原轴线轻跟", "action": "夜蛾低速靠近花心", "transition_in": "从右侧入口连续进入", "transition_out": "停在触花前", "prompt": "S02 MEET：同一只褐色夜蛾从右侧靠近同一朵白色兰花，只执行接近，不提前触花。" },
        { "shot_id": "S03", "stage": "TOUCH", "duration_s": 2, "frame": "口器与花心的微距接触点", "camera": "极短微距推进后锁定", "action": "口器刚触到花心，翅膀持续细微振动", "transition_in": "承接悬停距离", "transition_out": "留出花瓣回弹的停顿", "prompt": "S03 TOUCH：口器刚触到花心，保持同一主体、花朵、光线和镜头侧别，不添加第二个动作。" },
        { "shot_id": "S04", "stage": "BREATHE", "duration_s": 2, "frame": "略宽构图中的夜蛾与白花", "camera": "微微后移并停住", "action": "背景叶影缓慢运动，主体保持接触", "transition_in": "从接触点自然拉开", "transition_out": "承接花瓣微动", "prompt": "S04 BREATHE：恢复呼吸空间，让暗绿色叶层退后；保持 SILENCE LAYER，不新增焦点。" },
        { "shot_id": "S05", "stage": "TRACE", "duration_s": 2, "frame": "花粉与回弹的花瓣成为唯一余韵", "camera": "完全停住", "action": "花瓣轻轻回弹，花粉留下，夜蛾仍在花前", "transition_in": "承接 S04 的微动", "transition_out": "在痕迹离开焦点前结束", "prompt": "S05 TRACE：只保留花瓣回弹和花粉留下的物理痕迹，事件结束但不被解释完。" }
      ]
    }
  }
}
