{
  "skill": "sayelf-nature-encounter",
  "version": "0.1.1",
  "nature_event": {
    "event_id": "NE-001",
    "title": "露水芦苇边的豆娘",
    "subject": "一只蓝灰色豆娘",
    "plant": "一根弯向水面的芦苇细茎与未完全展开的叶片",
    "habitat": "清晨湿地边缘，浅水、芦苇根部和低矮水草共同形成的狭小水岸空间",
    "relationship": "豆娘从低处飞来，悬停在弯曲芦苇细茎前，准备落下借力",
    "decisive_moment": "豆娘后足即将接触细茎，翅膀仍半透明地张开，芦苇尖端被气流和重量预先压低",
    "moment_phase": "before_touch",
    "physical_trace": "细茎轻微回弹，叶缘的一颗露珠沿着弧线缓慢下滑",
    "camera": {
      "position": "贴近水面、略低于芦苇中段，从侧前方观察，不越过植物的自然遮挡",
      "lens_feel": "真实微距长焦压缩感，浅景深但保留可辨认的中景湿地层",
      "composition": "豆娘位于偏右的呼吸空间中，弯曲细茎从左下引向关系发生点，前景一片失焦芦苇叶形成自然边缘"
    },
    "light": "阴晴交界的清晨自然散射光，水面反光从下方微弱补亮，露珠只在朝向天空的表面闪光",
    "silence_layer": "远处低信息密度的湿地绿色与灰蓝水面，只保留柔和光斑、轻微水纹和一两片失焦叶缘，不让背景制造第二个焦点",
    "grammar": ["DWELL", "MEET", "TOUCH", "BREATHE", "TRACE"],
    "locks": {
      "reality_lock": [
        "只使用可解释的湿地结构：芦苇细茎、叶片、浅水、露珠和低矮水草",
        "豆娘体态、翅脉、足部接触点和尺度保持真实昆虫比例",
        "光源来自清晨自然散射光，露珠只出现在可接触的植物表面，景深服从真实微距光学"
      ],
      "continuity_lock": [
        "NE-001 始终是同一只蓝灰色豆娘、同一根弯曲芦苇细茎和同一处清晨水岸",
        "豆娘保持从画面右侧接近并向左下细茎落下的空间方向，光线方向不改变",
        "事件时间只从悬停推进到接触、回弹和露珠下滑，不跳季节、不跳天气、不换镜头轴线"
      ],
      "negative_lock": [
        "不要第二只昆虫、鸟、人物或额外花朵抢走关系焦点",
        "不要梦幻光晕、彩色能量、塑料植物、CGI、3D 渲染或假散景",
        "不要人工布景、完美对称、棚拍光、过度 HDR 或所有景物同时清晰",
        "不要改变豆娘颜色、芦苇形状、清晨时段、镜头侧别或空间方向",
        "不要文字、字幕、标题、标志、水印、边框或把自然事件解释成戏剧表演"
      ]
    }
  },
  "outputs": {
    "image": {
      "id": "01 IMAGE",
      "kind": "IMAGE",
      "event_id": "NE-001",
      "grammar": ["DWELL", "MEET", "TOUCH", "BREATHE", "TRACE"],
      "prompt": "真实自然微距摄影，竖幅 9:16，只表现一个安静而真实的生命相遇。\n\n[DWELL｜栖] 清晨湿地边缘，浅水、芦苇根部和低矮水草共同形成的狭小水岸空间；保留自然生长的不规则、潮湿、轻微损伤与真实前景遮挡。\n\n[MEET｜遇] 一只蓝灰色豆娘与一根弯向水面的芦苇细茎相遇。豆娘从低处飞来，悬停在细茎前，准备落下借力；它们必须在同一物理空间中互相影响，而不是并列装饰。\n\n[TOUCH｜触] 豆娘后足即将接触细茎，翅膀仍半透明地张开，芦苇尖端被气流和重量预先压低。时间相位是 before_touch，只保留这一处主要关系张力。\n\n[BREATHE｜息] 贴近水面、略低于芦苇中段，从侧前方观察；真实微距长焦压缩感，豆娘位于偏右的呼吸空间中，背景是低信息密度的湿地绿色与灰蓝水面，只保留柔和光斑、轻微水纹和一两片失焦叶缘。\n\n[TRACE｜留] 细茎轻微回弹，叶缘的一颗露珠沿着弧线缓慢下滑，动作保持未完成的余韵。清晨自然散射光，水面反光从下方微弱补亮。\n\nSILENCE LAYER：远处低信息密度的湿地绿色与灰蓝水面，不制造第二个焦点。\nReality Lock：只使用可解释的湿地结构；豆娘体态、翅脉、足部接触点和尺度保持真实昆虫比例；露珠和景深服从真实微距光学。\nContinuity Lock：NE-001 始终是同一只蓝灰色豆娘、同一根弯曲芦苇细茎和同一处清晨水岸；空间方向与光线方向不改变；事件只从悬停推进到接触、回弹和露珠下滑。\nNegative Lock：不要第二只昆虫、鸟、人物或额外花朵；不要梦幻光晕、CGI、3D 渲染或假散景；不要人工布景、棚拍光、过度 HDR 或所有景物同时清晰；不要改变主体、季节、镜头侧别或空间方向；不要文字、字幕、标志或水印。\n\n五段语法固定为 DWELL → MEET → TOUCH → BREATHE → TRACE。",
      "silence_layer": "远处低信息密度的湿地绿色与灰蓝水面，只保留柔和光斑、轻微水纹和一两片失焦叶缘，不让背景制造第二个焦点",
      "reality_lock": [
        "只使用可解释的湿地结构：芦苇细茎、叶片、浅水、露珠和低矮水草",
        "豆娘体态、翅脉、足部接触点和尺度保持真实昆虫比例",
        "光源来自清晨自然散射光，露珠只出现在可接触的植物表面，景深服从真实微距光学"
      ],
      "continuity_lock": [
        "NE-001 始终是同一只蓝灰色豆娘、同一根弯曲芦苇细茎和同一处清晨水岸",
        "豆娘保持从画面右侧接近并向左下细茎落下的空间方向，光线方向不改变",
        "事件时间只从悬停推进到接触、回弹和露珠下滑，不跳季节、不跳天气、不换镜头轴线"
      ],
      "negative_lock": [
        "不要第二只昆虫、鸟、人物或额外花朵抢走关系焦点",
        "不要梦幻光晕、彩色能量、塑料植物、CGI、3D 渲染或假散景",
        "不要人工布景、完美对称、棚拍光、过度 HDR 或所有景物同时清晰",
        "不要改变豆娘颜色、芦苇形状、清晨时段、镜头侧别或空间方向",
        "不要文字、字幕、标题、标志、水印、边框或把自然事件解释成戏剧表演"
      ]
    },
    "video": {
      "id": "02 VIDEO",
      "kind": "VIDEO",
      "event_id": "NE-001",
      "grammar": ["DWELL", "MEET", "TOUCH", "BREATHE", "TRACE"],
      "prompt": "从 01 IMAGE 的同一关键帧开始，把 NE-001 这个自然事件连续展开为五个镜头。只允许 DWELL → MEET → TOUCH → BREATHE → TRACE 按顺序发生；保持同一只蓝灰色豆娘、同一根弯曲芦苇细茎、同一处清晨水岸、同一侧别、同一光线方向和低信息密度 SILENCE LAYER。动作服从 Reality Lock，连续性服从 Continuity Lock，所有排除项服从 Negative Lock。不要新增生命主体、植物种类、道具、季节、时间、文字或戏剧性结局。",
      "silence_layer": "远处低信息密度的湿地绿色与灰蓝水面，只保留柔和光斑、轻微水纹和一两片失焦叶缘，不让背景制造第二个焦点",
      "reality_lock": [
        "只使用可解释的湿地结构：芦苇细茎、叶片、浅水、露珠和低矮水草",
        "豆娘体态、翅脉、足部接触点和尺度保持真实昆虫比例",
        "光源来自清晨自然散射光，露珠只出现在可接触的植物表面，景深服从真实微距光学"
      ],
      "continuity_lock": [
        "NE-001 始终是同一只蓝灰色豆娘、同一根弯曲芦苇细茎和同一处清晨水岸",
        "豆娘保持从画面右侧接近并向左下细茎落下的空间方向，光线方向不改变",
        "事件时间只从悬停推进到接触、回弹和露珠下滑，不跳季节、不跳天气、不换镜头轴线"
      ],
      "negative_lock": [
        "不要第二只昆虫、鸟、人物或额外花朵抢走关系焦点",
        "不要梦幻光晕、彩色能量、塑料植物、CGI、3D 渲染或假散景",
        "不要人工布景、完美对称、棚拍光、过度 HDR 或所有景物同时清晰",
        "不要改变豆娘颜色、芦苇形状、清晨时段、镜头侧别或空间方向",
        "不要文字、字幕、标题、标志、水印、边框或把自然事件解释成戏剧表演"
      ],
      "storyboard": [
        {
          "shot_id": "S01",
          "stage": "DWELL",
          "duration_s": 2,
          "frame": "贴近水面的低机位，前景失焦芦苇叶缘，中景是弯曲细茎与浅水，远处灰绿色湿地安静展开",
          "camera": "极慢向右侧滑动，保持低于芦苇中段的侧前方视线",
          "action": "只有水纹和叶片被微风轻轻带动，豆娘尚未进入画面中心",
          "transition_in": "从 01 IMAGE 的自然静止状态进入，不改变光线和镜头侧别",
          "transition_out": "沿同一水岸方向，让画面右侧留出豆娘即将进入的空间",
          "prompt": "S01 DWELL，2 秒。先让清晨湿地作为活着的微型栖息地存在：贴近水面的低机位，前景一片失焦芦苇叶，中景弯曲细茎与浅水，远处低信息密度灰绿色湿地。只有水纹和叶片被微风轻轻带动；极慢向右侧滑动，不新增主体，不改变自然光。"
        },
        {
          "shot_id": "S02",
          "stage": "MEET",
          "duration_s": 2,
          "frame": "保持同一构图与空间方向，豆娘从画面右侧进入，停在弯曲细茎前的空气中",
          "camera": "沿原轴线轻微跟随豆娘，幅度小，不追焦过度",
          "action": "豆娘低速接近细茎，翅膀保持半透明张开，细茎开始轻轻下压",
          "transition_in": "承接 S01 右侧预留空间，保持水岸和背景不变",
          "transition_out": "在豆娘与细茎之间留下清晰的几厘米距离，进入接触临界点",
          "prompt": "S02 MEET，2 秒。保持 S01 的同一只蓝灰色豆娘、同一根弯曲芦苇细茎、同一镜头侧别与清晨散射光。豆娘从画面右侧低速接近并悬停在细茎前，翅膀半透明张开，细茎因气流轻微下压；只执行接近，不提前落下。"
        },
        {
          "shot_id": "S03",
          "stage": "TOUCH",
          "duration_s": 2,
          "frame": "关系发生点的微距近景，豆娘后足接近细茎，翅脉与茎表面可辨认但不超锐",
          "camera": "极短的微距推进，随后保持稳定，焦点落在后足与细茎之间",
          "action": "后足刚刚接触细茎，翅膀由张开开始收拢，细茎发生可见但克制的弯曲",
          "transition_in": "从 S02 的悬停距离连续推进，不跳切空间关系",
          "transition_out": "接触完成后立即保留一瞬微小停顿，给回弹留下时间",
          "prompt": "S03 TOUCH，2 秒。沿 S02 的同一空间关系做极短微距推进，焦点在豆娘后足与芦苇细茎的接触点。后足刚刚接触，翅膀开始收拢，细茎出现真实而克制的弯曲；不要加入第二个动作或夸张慢动作。"
        },
        {
          "shot_id": "S04",
          "stage": "BREATHE",
          "duration_s": 2,
          "frame": "回到略宽的呼吸构图，豆娘与细茎在偏右区域，湿地绿色负空间重新占据大部分画面",
          "camera": "轻微后移并停住，保持真实光学景深和原来的水平方向",
          "action": "豆娘稳定停在细茎上，背景水纹与失焦叶缘继续缓慢运动",
          "transition_in": "从接触点的停顿自然拉开，不改变主体颜色、植物形状或光线",
          "transition_out": "让细茎和叶缘的微小运动承接到最后的露珠痕迹",
          "prompt": "S04 BREATHE，2 秒。轻微后移回到略宽的呼吸构图，豆娘稳定停在偏右的弯曲芦苇细茎上；低信息密度湿地绿色和灰蓝水面占据大部分画面，背景水纹与失焦叶缘缓慢运动。保持 SILENCE LAYER 安静，不新增景物或焦点。"
        },
        {
          "shot_id": "S05",
          "stage": "TRACE",
          "duration_s": 2,
          "frame": "保持同一构图，豆娘和细茎退为关系的安静见证，叶缘露珠成为唯一微小余韵",
          "camera": "完全停住，只允许自然微动，不再追加镜头运动",
          "action": "细茎轻微回弹，叶缘的一颗露珠沿弧线下滑，豆娘保持停驻",
          "transition_in": "承接 S04 的细茎微动，保持所有连续性锁不变",
          "transition_out": "露珠滑出清晰焦点前结束，保留事件未被解释完的余韵",
          "prompt": "S05 TRACE，2 秒。镜头完全停住，只保留真实自然微动：细茎轻微回弹，叶缘的一颗露珠沿弧线下滑，豆娘仍停驻。露珠是唯一的微小物理痕迹，不新增动作、主体或戏剧性结局；在露珠离开清晰焦点前结束。"
        }
      ]
    }
  }
}
